### ISSUE TITLE
Cannot receive big files on Linux Mint 20

### ISSUE THREAD

**Issue by Matzz** [SmingHub/Sming#2182]
Hi,
I have quite weird problem. I cannot fetch huge files using WebServer and spiffs. When I request them `curl` / `netcat` just hangs.
It happens only when I access ESP8266 wifi using my Linux. When I switch to Windows on the same machine everything is working fine. Android phone is also downloading this file correctlly..
I wouldn't create that issue if I had some other networking issues with my laptop. However, all web pages using home wifi works fine on linux.

I made some sample project which I use to reproduce that issue. All logs are attached there.
 
https://github.com/Matzz/SmingBigFileIssue

# Linux
```
hostnamectl
   Static hostname: ---
         Icon name: ---
           Chassis: laptop
        Machine ID: ---
           Boot ID: ---
  Operating System: Linux Mint 20
            Kernel: Linux 5.4.0-56-generic
      Architecture: x86-64

```
Files mounted to spiffs:
```
rw-rw-r-- 1 matzz matzz  84K Dec 12 23:26 jquery.min.js
-rw-rw-r-- 1 matzz matzz   13 Dec 12 21:37 test.txt
```

### Request:
```
echo -e "GET /get?file=test.txt\n\n" | nc 192.168.4.1 80
HTTP/1.1 200 OK
Content-Type: text/plain
ETag: "00f-2-d0-8"
Content-Length: 13
Connection: keep-alive
Server: HttpServer/Sming

a
b
cde
1234
```

### Logs:

```
271542673 onAccept, tcp: 3fff1360, state: 0 K=0, Free heap size=43904
271542976 TCP 3fff14c8 +connection
271543345 TCP 3fff14c8 timeout updating: 70 -> 0
271545457 Opening connection. Total connections: 1
271549902 TcpServer onClient: 192.168.4.2

271555572 The headers are complete
271571410 found test.txt
271571793 attached file: 'test.txt' (13 bytes) #0x3fff1170
271572899 MemoryDataStream::realloc 0 -> 17
271573062 Storing 17 bytes in stream
271575532 MemoryDataStream::realloc 17 -> 171
271579152 Storing 26 bytes in stream
271582472 Storing 20 bytes in stream
271585781 Storing 20 bytes in stream
271589083 Storing 24 bytes in stream
271592359 Storing 26 bytes in stream
271595625 Storing 2 bytes in stream
271598876 TCP 3fff14c8 onReadyToSendData: 1
271602962 TCP 3fff14c8 Written: 135, Available: 2780, isFinished: 0, PushCount: 1
271609967 TcpClient stream finished
271613643 TCP 3fff14c8 Written: 13, Available: 2645, isFinished: 0, PushCount: 1
271620293 TcpClient stream finished
271623899 TCP 3fff14c8 received: 25 bytes
271627195 TCP 3fff14c8 onReadyToSendData: 1
271633320 TCP 3fff14c8 sent: 148
271634075 TCP 3fff14c8 onReadyToSendData: 2
272572980 TCP 3fff14c8 connection closed by timeout: 1 (from 0)
272573220 TCP 3fff14c8 connection closing
272573648 TCP 3fff14c8 ~connection
272574557 Destroying connection. Total connections: 0
272847971 -TCP connection

```

### Request

```
echo -e "GET /get?file=jquery.min.js\n\n" | nc 192.168.4.1 80
[Here it hangs...]
```

### Logs
```
272847971 -TCP connection
351709706 onAccept, tcp: 3fff1360, state: 0 K=0, Free heap size=43904
351710049 TCP 3fff14c8 +connection
351710416 TCP 3fff14c8 timeout updating: 70 -> 0
351712523 Opening connection. Total connections: 1
351716967 TcpServer onClient: 192.168.4.2

351722774 The headers are complete
351751884 found jquery.min.js
351761020 attached file: 'jquery.min.js' (85659 bytes) #0x3fff1840
351762241 MemoryDataStream::realloc 0 -> 17
351762390 Storing 17 bytes in stream
351763730 MemoryDataStream::realloc 17 -> 176
351767345 Storing 31 bytes in stream
351770668 Storing 24 bytes in stream
351773972 Storing 23 bytes in stream
351777273 Storing 24 bytes in stream
351780558 Storing 26 bytes in stream
351783820 Storing 2 bytes in stream
351787071 TCP 3fff14c8 onReadyToSendData: 1
351791164 TCP 3fff14c8 Written: 147, Available: 2780, isFinished: 0, PushCount: 1
351798166 TcpClient stream finished
351802172 TCP 3fff14c8 Written: 1024, Available: 2633, isFinished: 0, PushCount: 1
351809178 TCP 3fff14c8 Written: 1024, Available: 1609, isFinished: 0, PushCount: 2
351816236 TCP 3fff14c8 Written: 585, Available: 585, isFinished: 0, PushCount: 3
351823169 TCP 3fff14c8 received: 30 bytes
352823017 TCP 3fff14c8 connection closed by timeout: 1 (from 0)
352823400 TCP 3fff14c8 connection closing
352824053 TCP 3fff14c8 ~connection
352824660 Destroying connection. Total connections: 0
353097979 -TCP connection
```

# Working file from Android phone browser (jquery.min.js):

## Request
When accessing `192.168.4.1/get?file=jquery.min.js` jquery.min.js is printed to browser window.

## Logs
```
431272995 -TCP connection
618668903 onAccept, tcp: 3fff1498, state: 0 K=0, Free heap size=43064
618669260 TCP 3fff17d8 +connection
618669645 TCP 3fff17d8 timeout updating: 70 -> 0
618671742 Opening connection. Total connections: 1
618676182 TcpServer onClient: 192.168.4.3

618680715 onAccept, tcp: 3fff1638, state: 0 K=1, Free heap size=42280
618686265 TCP 3fff1b80 +connection
618689450 TCP 3fff1b80 timeout updating: 70 -> 0
618693726 Opening connection. Total connections: 2
618698200 TcpServer onClient: 192.168.4.3

618706897 The headers are complete
618723878 found jquery.min.js
618733035 attached file: 'jquery.min.js' (85659 bytes) #0x3fff1740
618734240 MemoryDataStream::realloc 0 -> 17
618734402 Storing 17 bytes in stream
618735746 MemoryDataStream::realloc 17 -> 176
618739391 Storing 31 bytes in stream
618742714 Storing 24 bytes in stream
618746021 Storing 23 bytes in stream
618749317 Storing 24 bytes in stream
618752608 Storing 26 bytes in stream
618755868 Storing 2 bytes in stream
618759120 TCP 3fff17d8 onReadyToSendData: 1
618763231 TCP 3fff17d8 Written: 147, Available: 2780, isFinished: 0, PushCount: 1
618770218 TcpClient stream finished
618774224 TCP 3fff17d8 Written: 1024, Available: 2633, isFinished: 0, PushCount: 1
618781228 TCP 3fff17d8 Written: 1024, Available: 1609, isFinished: 0, PushCount: 2
618788284 TCP 3fff17d8 Written: 585, Available: 585, isFinished: 0, PushCount: 3
618795221 TCP 3fff17d8 received: 533 bytes
618847338 TCP 3fff17d8 sent: 1390
618847655 TCP 3fff17d8 onReadyToSendData: 2
618848583 TCP 3fff17d8 Written: 1024, Available: 1390, isFinished: 0, PushCount: 1
618851013 TCP 3fff17d8 Written: 366, Available: 366, isFinished: 0, PushCount: 2
618858986 TCP 3fff17d8 sent: 1390
618860893 TCP 3fff17d8 onReadyToSendData: 2
618865374 TCP 3fff17d8 Written: 1024, Available: 1390, isFinished: 0, PushCount: 1
618872271 TCP 3fff17d8 Written: 366, Available: 366, isFinished: 0, PushCount: 2
618880152 TCP 3fff17d8 sent: 1390
618882224 TCP 3fff17d8 onReadyToSendData: 2
618886716 TCP 3fff17d8 Written: 1024, Available: 1390, isFinished: 0, PushCount: 1
618893690 TCP 3fff17d8 Written: 366, Available: 366, isFinished: 0, PushCount: 2
618901496 TCP 3fff17d8 sent: 1390
618903568 TCP 3fff17d8 onReadyToSendData: 2
618908055 TCP 3fff17d8 Written: 1024, Available: 1390, isFinished: 0, PushCount: 1
618914951 TCP 3fff17d8 Written: 366, Available: 366, isFinished: 0, PushCount: 2
618922892 TCP 3fff17d8 sent: 1390
618924909 TCP 3fff17d8 onReadyToSendData: 2
618929415 TCP 3fff17d8 Written: 1024, Available: 1390, isFinished: 0, PushCount: 1
618936374 TCP 3fff17d8 Written: 366, Available: 366, isFinished: 0, PushCount: 2
618944290 TCP 3fff17d8 sent: 1390
618946254 TCP 3fff17d8 onReadyToSendData: 2
618950740 TCP 3fff17d8 Written: 1024, Available: 1390, isFinished: 0, PushCount: 1
618957634 TCP 3fff17d8 Written: 366, Available: 366, isFinished: 0, PushCount: 2
619823546 TCP 3fff1b80 connection closed by timeout: 1 (from 0)
619823827 TCP 3fff1b80 connection closing
619824220 TCP 3fff1b80 ~connection
619825161 Destroying connection. Total connections: 1
620069365 TCP 3fff17d8 sent: 2780
620069647 TCP 3fff17d8 onReadyToSendData: 2
620070560 TCP 3fff17d8 Written: 1024, Available: 2780, isFinished: 0, PushCount: 1
620073215 TCP 3fff17d8 Written: 1024, Available: 1756, isFinished: 0, PushCount: 2
620080324 TCP 3fff17d8 Written: 732, Available: 732, isFinished: 0, PushCount: 3
620090005 TCP 3fff17d8 sent: 1390
620090296 TCP 3fff17d8 onReadyToSendData: 2
620094714 TCP 3fff17d8 Written: 1024, Available: 1390, isFinished: 0, PushCount: 1
620101605 TCP 3fff17d8 Written: 366, Available: 366, isFinished: 0, PushCount: 2
620109301 TCP 3fff17d8 sent: 1390
620111484 TCP 3fff17d8 onReadyToSendData: 2
620115989 TCP 3fff17d8 Written: 1024, Available: 1390, isFinished: 0, PushCount: 1
620122862 TCP 3fff17d8 Written: 366, Available: 366, isFinished: 0, PushCount: 2
620130797 TCP 3fff17d8 sent: 1390
620132829 TCP 3fff17d8 onReadyToSendData: 2
620137338 TCP 3fff17d8 Written: 1024, Available: 1390, isFinished: 0, PushCount: 1
620144289 TCP 3fff17d8 Written: 366, Available: 366, isFinished: 0, PushCount: 2
620151919 -TCP connection
620154013 TCP 3fff17d8 sent: 1390
620156519 TCP 3fff17d8 onReadyToSendData: 2
620161049 TCP 3fff17d8 Written: 1024, Available: 1390, isFinished: 0, PushCount: 1
620167890 TCP 3fff17d8 Written: 366, Available: 366, isFinished: 0, PushCount: 2
620175863 TCP 3fff17d8 sent: 1390
620177848 TCP 3fff17d8 onReadyToSendData: 2
620182434 TCP 3fff17d8 Written: 1024, Available: 1390, isFinished: 0, PushCount: 1
620189231 TCP 3fff17d8 Written: 366, Available: 366, isFinished: 0, PushCount: 2
621298272 TCP 3fff17d8 connection closed by timeout: 1 (from 0)
621298620 TCP 3fff17d8 connection closing
621299493 TCP 3fff17d8 ~connection
621299874 Destroying connection. Total connections: 0
621548015 -TCP connection
```

**Comment by slaff** [comment]
> [Here it hangs...]

Install Wireshark on the Linux machine where the problem happens. Reproduce the problem and during the reproduction capture with Wireshark  the incoming and outgoing data from the device to your computer and save it to file and send us the file (attach it to your next comment). My wild guess is that the [TCP MSS](https://en.wikipedia.org/wiki/Maximum_segment_size) value is problematic for your distribution.

**Comment by slaff** [comment]
> 352823017 TCP 3fff14c8 connection closed by timeout: 1 (from 0)

Or maybe the timeout on the server is too low. You can increase the default server timeout to a bigger value like 5 or 10. 
```c++
HttpServer server;

void gotIP(IpAddress ip, IpAddress netmask, IpAddress gateway)
{
   //...
   HttpServerSettings settings;
   settings.keepAliveSeconds = 5;
   server.configure(settings);
}

**Comment by Matzz** [comment]
I thought that it might be my laptop / distro related. So I downloaded Fedora live cd and started it on a different computer.
However the results were exactly the same. So it is Linux / Linux kernel related.


I allso tried to set folowing settings but without any success.
```
	settings.keepAliveSeconds = 10;
	server->setTimeOut(5000);
```

I also tested different file which contains many short lines rather than very long line like jquery.min.js. No luck.

**Comment by Matzz** [comment]
Wireshark logs:
```
echo -e "GET /get?file=jquery.min.js\n" | netcat 192.168.4.1 80
```
```
1	0.000000000	192.168.4.2	192.168.4.1	TCP	74	42026 → 80 [SYN] Seq=0 Win=64480 Len=0 MSS=1240 SACK_PERM=1 TSval=2857396046 TSecr=0 WS=128
2	0.004989016	192.168.4.1	192.168.4.2	TCP	58	80 → 42026 [SYN, ACK] Seq=0 Ack=1 Win=5560 Len=0 MSS=1390
3	0.005063974	192.168.4.2	192.168.4.1	TCP	54	42026 → 80 [ACK] Seq=1 Ack=1 Win=64480 Len=0
4	0.005234305	192.168.4.2	192.168.4.1	HTTP	83	GET /get?file=jquery.min.js 
5	0.113913378	192.168.4.1	192.168.4.2	TCP	54	80 → 42026 [ACK] Seq=1 Ack=30 Win=5531 Len=0
```
Then netcat session hangs.

**Comment by slaff** [comment]
> Wireshark logs:

It would be great to send me the wireshark capture. The logs don't contain all the information.

> echo -e "GET /get?file=jquery.min.js\n"

That is not a valid HTTP request to start with. You are missing the version information in the first line as well as a mandatory HOST header. A proper way to to test will be:

```
curl -vvv http://192.168.4.1 80/get?file=jquery.min.js
```

**Comment by Matzz** [comment]
@slaff I just wanted to make it minimal to reduce influence other parts of request. Usually GET just works (and it work here for small file).
I sent you Wireshark log for `curl 192.168.4.1/get?file=jquery.min.js -i` request to email address found in Sming git log.

**Comment by slaff** [comment]
Short story: Please, send me a sample so that I can reproduce the problem locally? I am also running Linux machines.

Long story: There is nothing suspicion in the TCP connection in the capture that you have send me.  There is just no HTTP response. 

What I can see is that you are actually using your device as access point and you are connected to it. This is an important detail that was omitted initially.  There might be an issue with ESP8266 being used as access point and, at the same time, trying to deliver a large file. But I can say more for sure only if I can reproduce the problem locally and for that I need a sample application from you.
![image](https://user-images.githubusercontent.com/247452/102197778-e6663400-3ec1-11eb-990a-fc04823937aa.png)

**Comment by Matzz** [comment]
@slaff The minimal code I use is available here - https://github.com/Matzz/SmingBigFileIssue
It should be enough to flash it to ESP8266 and try to connect.
Thanks!

**Comment by slaff** [comment]
Works like charm for me. No hiccups, no delays. No issues in Wireshark. I am sending you the compiled code that I have used together with the application output.txt and the config.txt with the configuration options used to compile this application. 

You can test the same compiled code by flashing the stuff (make flash). The commands that I have used to test were:
```
curl -vvv http://192.168.4.1/get?file=jquery.min.js
curl -vvv http://192.168.4.1/test
curl -vvv http://192.168.4.1/get?file=jquery.min.js
curl -vvv http://192.168.4.1/test
curl -vvv http://192.168.4.1/get?file=jquery.min.js
```

[SmingBigFileIssue.zip](https://github.com/SmingHub/Sming/files/5695514/SmingBigFileIssue.zip)

**Comment by Matzz** [comment]
@slaff I flashed your roms that way:
```
python /data/Sming/Sming/Components/esptool/esptool/esptool.py -p /dev/ttyUSB0 -b 115200 --chip esp8266 --before default_reset --after hard_reset write_flash -z -ff 40m -fm dio -fs 4MB 0x00000 out/Esp8266/debug/firmware/rboot.bin 0x002000 out/Esp8266/debug/firmware/rom0.bin 0x100000 out/Esp8266/debug/firmware/spiff_rom.bin
```
and still have the same issue. Maybe its hardware problem of my wemos or some internal persistent config issue? I'll try with another chip and post update here.

Thanks for taking your time.

**Comment by Matzz** [comment]
@slaff I ordered brand new wemos chip and have the same effect. Maybe its sth with my ESP/Sming setup wrong?
Do you think such issue could be related to esp_init_data_default.bin (that's is the only firmware piece which I not flashed from your archive SmingBigFileIssue.zip)
 I'll try to download some Sming docker image and try reproduce it there.

**Comment by anakod** [comment]
May be issue related to power supply? Can you check it with another USB cable and different power supply?

**Comment by Matzz** [comment]
@anakod @slaff Its not a power supply issue.
To be sure that I use clean env I downloaded precompiled esp toolchaing (SmingTools). With the same result.
So the issue is not related to:
- computer (tested on 2 laptops)
- toolchain (downloaded precompiled)
- chip (tested on two)
- command (tested curl, nc, and wget)
- client system (the same on ubuntu and fedora)

The next step was to run ubuntu docker image and try to curl from it. And it... worked. However when I switch docker to `--network=host` issue persist.

**Comment by Matzz** [comment]
I finaly resolved it on my laptop. Setting MTU to 1500 fixed that. My defaut value was 1280 (which is somehow related to ip6)
```
3: wlp7s0: <BROADCAST,MULTICAST,UP,LOWER_UP> mtu 1280 qdisc noqueue state UP mode DORMANT group default qlen 1000
    link/ether f8:a2:d6:e6:6c:d3 brd ff:ff:ff:ff:ff:ff
```
```
sudo ip link set dev wlp7s0 mtu 1500
```

**Comment by Matzz** [comment]
https://github.com/SmingHub/Sming/issues/406

**Comment by Matzz** [comment]
Im closing that issue as it seems to not be directly related to Sming.
